{
  "metadata": {
    "schema": "mixing-project",
    "schema_version": "1.1.0",
    "document_id": "44444444-4444-4444-8444-444444444444",
    "created_with": "jl-mixing 1.1.0",
    "created_at": "2026-07-14T20:10:00-04:00",
    "last_modified_at": "2026-07-20T14:00:00-04:00"
  },
  "project_id": "blue-sky",
  "project_name": "Blue Sky",
  "client": {
    "client_document_id": "22222222-2222-4222-8222-222222222222",
    "client_id": "acme"
  },
  "artist": "The Example Band",
  "album": "",
  "producer": "",
  "mix_engineer": "Jake",
  "music": {
    "bpm": 112,
    "key": "D major",
    "time_signature": "4/4"
  },
  "audio": {
    "sample_rate": 48000,
    "bit_depth": 24,
    "file_format": "WAV"
  },
  "delivery": {
    "method": "Cloud transfer",
    "requested_deliverables": [
      "main_mix",
      "instrumental"
    ]
  },
  "schedule": {
    "deadline": null
  },
  "creative_direction": "Keep the verses intimate and let the choruses open up.",
  "state": {
    "current_revision": 3,
    "approved_revision": 3,
    "delivered_revision": 3
  },
  "revisions": [
    {
      "number": 1,
      "revision_id": "55555555-5555-4555-8555-555555555551",
      "created_at": "2026-07-17T10:00:00-04:00",
      "description": "Initial mix",
      "approval": {
        "approved_at": null,
        "approved_by": null
      }
    },
    {
      "number": 2,
      "revision_id": "55555555-5555-4555-8555-555555555552",
      "created_at": "2026-07-18T10:00:00-04:00",
      "description": "Client notes addressed",
      "approval": {
        "approved_at": null,
        "approved_by": null
      }
    },
    {
      "number": 3,
      "revision_id": "55555555-5555-4555-8555-555555555553",
      "created_at": "2026-07-20T11:00:00-04:00",
      "description": "Final vocal balance",
      "approval": {
        "approved_at": "2026-07-20T14:00:00-04:00",
        "approved_by": "Client"
      }
    }
  ]
}
